{
  "$schema": "https://json-schema.org/draft/2020-12/schema",
  "$id": "https://cloverleaf.example/schemas/task.schema.json",
  "title": "Task",
  "description": "A Cloverleaf Delivery work unit. The atomic unit of execution.",
  "type": "object",
  "required": ["id", "type", "status", "owner", "project", "title", "context", "definition_of_done", "acceptance_criteria", "risk_class"],
  "properties": {
    "id": { "$ref": "https://cloverleaf.example/schemas/work-item.schema.json#/$defs/workItemId" },
    "type": { "const": "task" },
    "status": {
      "type": "string",
      "enum": [
        "pending", "tactical-plan", "implementing", "documenting",
        "review", "automated-gates", "ui-review", "qa", "final-gate",
        "merged", "rejected", "escalated"
      ]
    },
    "owner": { "$ref": "https://cloverleaf.example/schemas/work-item.schema.json#/$defs/owner" },
    "project": { "type": "string", "minLength": 1 },
    "parent": {
      "description": "Parent Plan reference. Tools should prefer context.rfc as the authoritative RFC reference.",
      "$ref": "https://cloverleaf.example/schemas/work-item.schema.json#/$defs/workItemRefOrNull"
    },
    "relationships": {
      "type": "array",
      "uniqueItems": true,
      "items": {
        "type": "object",
        "required": ["type", "target"],
        "properties": {
          "type": { "$ref": "https://cloverleaf.example/schemas/work-item.schema.json#/$defs/relationshipType" },
          "target": { "$ref": "https://cloverleaf.example/schemas/work-item.schema.json#/$defs/workItemRef" }
        },
        "additionalProperties": false
      }
    },
    "title": { "type": "string", "minLength": 1 },
    "context": {
      "type": "object",
      "required": ["rfc"],
      "properties": {
        "rfc": {
          "description": "Parent RFC reference (authoritative).",
          "$ref": "https://cloverleaf.example/schemas/work-item.schema.json#/$defs/workItemRef"
        },
        "spikes": {
          "description": "Relevant Spike references that informed this Task.",
          "type": "array",
          "items": { "$ref": "https://cloverleaf.example/schemas/work-item.schema.json#/$defs/workItemRef" },
          "uniqueItems": true
        }
      },
      "additionalProperties": false
    },
    "definition_of_done": {
      "type": "array",
      "items": { "type": "string", "minLength": 1 },
      "minItems": 1,
      "description": "Explicit, testable. What must be true."
    },
    "acceptance_criteria": {
      "type": "array",
      "items": { "type": "string", "minLength": 1 },
      "minItems": 1,
      "description": "Test scenarios / verifiable behaviors."
    },
    "risk_class": {
      "type": "string",
      "enum": ["low", "high"],
      "description": "Computed by the deterministic Risk Classifier. 'low' = Fast Lane eligible; 'high' = Full Pipeline."
    },
    "extensions": { "$ref": "https://cloverleaf.example/schemas/extensions.schema.json" },
    "scope": {
      "description": "Optional task scope metadata. Added in Standard 0.5.0.",
      "type": "object",
      "properties": {
        "files_touched": {
          "description": "Repo-root-relative POSIX paths of files this task is expected to modify.",
          "type": "array",
          "items": { "type": "string", "minLength": 1 },
          "uniqueItems": true
        }
      },
      "additionalProperties": false
    }
  },
  "additionalProperties": false
}
