{
  "type": "task",
  "id": "CLV-89",
  "project": "CLV",
  "status": "merged",
  "owner": {
    "kind": "agent",
    "id": "implementer"
  },
  "parent": {
    "project": "CLV",
    "id": "CLV-85"
  },
  "title": "Release-prep: bump reference-impl to 0.7.1 and finalise CHANGELOG",
  "context": {
    "rfc": {
      "project": "CLV",
      "id": "CLV-84"
    }
  },
  "definition_of_done": [
    "reference-impl/package.json version is 0.7.1 and @cloverleaf/standard dep remains ^0.5.0",
    "reference-impl/CHANGELOG.md has ## [Unreleased] renamed to ## 0.7.1 — 2026-04-29 consolidating Documenter entries from Items 1+2+3",
    "CHANGELOG section calls out: walker pre-merge contested check, auto-extension on uncontested, two new CLI subcommands check-scope and extend-scope, Implementer prompt nudge",
    "Local npm publish --dry-run in reference-impl/ succeeds",
    "git tag reference-impl-v0.7.1 is ready (publish/release is operator action, not part of task DoD)"
  ],
  "acceptance_criteria": [
    "package.json version field is exactly 0.7.1",
    "@cloverleaf/standard dependency remains ^0.5.0 unchanged",
    "CHANGELOG.md contains a section heading ## 0.7.1 — 2026-04-29",
    "CHANGELOG section includes bullets for: walker pre-merge contested check, auto-extension on uncontested, check-scope subcommand, extend-scope subcommand, and Implementer prompt nudge",
    "npm publish --dry-run in reference-impl/ exits 0 with no errors"
  ],
  "risk_class": "high",
  "scope": {
    "files_touched": [
      "reference-impl/package.json",
      "reference-impl/CHANGELOG.md"
    ]
  }
}
