{
  "id": "CLV-001",
  "type": "task",
  "status": "merged",
  "owner": {
    "kind": "agent",
    "id": "implementer"
  },
  "project": "CLV",
  "title": "Glob schemas dynamically in lib/validate.ts",
  "context": {
    "rfc": {
      "project": "CLV",
      "id": "CLV-RFC-001"
    }
  },
  "acceptance_criteria": [
    "reference-impl/lib/validate.ts no longer hardcodes SCHEMA_FILES as a string array",
    "All .schema.json files under @cloverleaf/standard/schemas/ are discovered dynamically via fs.readdirSync (filter to files ending in .schema.json)",
    "Existing validate.test.ts test suite continues to pass without changes",
    "Full reference-impl test suite (npm test) remains at 54 passing tests",
    "npx tsc --noEmit is clean"
  ],
  "definition_of_done": [
    "lib/validate.ts uses dynamic schema discovery",
    "SCHEMA_FILES constant is removed",
    "Tests pass and TypeScript compiles"
  ],
  "risk_class": "low"
}
